ID	POEM_NUMBER	POEM	STANZA	LINE_ORDER	LINE_IN_SOURCE	LINE	RHYMEIDS	ALIGNMENT
1	1	Zwielicht	1	1	Dämmrung will die Flügel spreiten	Dämmrung + will + die + Flügel + spreiten	0 0 0 0 1	Dämmrung + will + die + Flügel + ( ʃ p ʁ ) ai t ə n
2	1	Zwielicht	1	2	Schaurig rühren sich die Bäume	Schaurig + rühren + sich + die + Bäume	0 0 0 0 2	Schaurig + rühren + sich + die + ( b - ) oi m ə
3	1	Zwielicht	1	3	Wolken ziehn wie schwere Träume	Wolken + ziehn + wie + schwere + Träume	0 0 0 0 2	Wolken + ziehn + wie + schwere + ( t ʁ ) oi m ə
4	1	Zwielicht	1	4	Was will dieses Graun bedeuten?	Was + will + dieses + Graun + bedeuten	0 0 0 0 1	Was + will + dieses + Graun + ( b ə d ) oi t ə n
5	1	Zwielicht	2	1	Hast ein Reh du lieb vor andern,	Hast + ein + Reh + du + lieb + vor + andern,	0 0 0 0 0 0 3	Hast + ein + Reh + du + lieb + vor + ( - ) a n d ɐ n
6	1	Zwielicht	2	2	Laß es nicht alleine grasen,	Laß + es + nicht + alleine + grasen,	0 0 0 0 4	Laß + es + nicht + alleine + ( g r ) aː z ə n
7	1	Zwielicht	2	3	Jäger zieh’n im Wald’ und blasen,	Jäger + zieh’n + im + Wald’ + und + blasen	0 0 0 0 0 4	Jäger + zieh’n + im + Wald’ + und + ( b l ) aː z ə n
8	1	Zwielicht	2	4	Stimmen hin und wider wandern.	Stimmen + hin + und + wider + wandern.	0 0 0 0 3	Stimmen + hin + und + wider + ( w ) a n d ɐ n
